,text,is_depressed
7204,"ALÔ CURITIBA, tem promoção de doces esse fim de semana <3, criei um combo onde tu poupa quase R$10 e leva só coisa fina para casa , ajudem no RT e façam uma universitária feliz",False
7205,"salem, we talked about this...…",False
7206,"“mama, puedo le contar una cosita? pero no fique bravita comigo”

yo                               mi mama",False
7207,"GENTE POR FAVOR

Eu e a  @crazyfroglady_ resgatamos esse doggo.

NOS AJUDE A CUSTEAR O PROCEDIMENTO DELE!!!!

CHAMA INBOX Q EU PASSO A CONTA!
1,2 REAIS, NÃO IMPORTA! JA AJUDA!!!@",False
7208,Designers corram aqui,False
7209,Aquele sinal pra ignorar a conta e gastar a grana em lanches...…,False
7210,deus ta de prova que eu tento pagar minhas conta mas o aplicativo ta zicadissimo não consigo fazer nada ai peguei e fui no banco tal qual nossos ancestrais ai o caixa me da operação não disponível no momento,False
7211,Eu começaria a redação com boa tarde amantes da sétima arte.,False
7212,sonhei que o tema da redação era o valor do cinema para a sociedade brasileira,False
7213,"Vamo faze um grupo  no whats App pra enviar foto de flor, pfvr",False
7214,"Essa flor sempre me lembra que em Portugal eles chamam de Noras e Sogras pois as flores estão sempre uma de costas pra outra, eh isto",False
7215,"objetivo: não me isolar tanto do mundo

obstaculo: editora que eu gosto com os livro q eu queria comprar com 30% de desconto",False
7216,n tenho pra quem ficar mandando minhas foto das florzinha então vai aqui mesmo,False
7217,ELZA DEUSA SOARES  @popstar,False
7218,"boa sorte pra quem vai fazer o enem

nao q vcs precisem de sorte pq é só confiar no que vcs fizeram o ano inteiro e respirar fundo que vai dar tudo certíssimo",False
7219,"Ensina muito a gente a não julgar o livro pela capa, a gente nunca sabe o que se pasaa no coração e na vida do outro. É triste saber que por trás de tamanha arrogância, existia uma pessoa pedindo socorro",False
7220,achei legal tbm essa análise q fizeram do programa,False
7221,"os dois episódios a gente começa ver pensa meu deus q pessoa sem noção mas ai vc vai vendo e sempre tem algum motivo pras pessoas agirem como elas agem e a gente nem tem ideia né 

no final ta todo mundo precisando só de um pouquinho de amor e compreensão mesmo",False
7222,"Nossa, chorei mt quando a Jenifer falou do bebê e quando o dono falou do irmão e da cunhada. Me fez pensar que ninguém é como é por acaso",False
7223,Perfeitos...Laçam álbum novo semana que vem. ,False
7224,"eu só escuto as mesmas coisas faz séculos pq n tenho vontade de conhecer nada novo mas esses dias tava ouvindo o daily mix e n deu tempo de mudar a musica q eu n conhecia e era essa banda aqui ai eu ouvi e gostei

agora estou viciadah ta feliz @SpotifyBR?…",False
7225,weverton é a gente quando acerta em qualquer coisa na vida…,False
7226,o episódio do pesadelo na cozinha do hero's burger eu dei uma choradinha no final não vou negar,False
7227,"Infelizmente o que a gente achava ridículo engoliu a realidade ou foi engolido pela realidade, já não importa mais.…",False
7228,Art.,False
7229,"Quando a gente não quer pensar na diferença entre ""porque, por que, porquê e por quê"" e escreve apenas pq... como dizem no twitter, elas que lutem…",False
7230,"o homem nasce bom, o freezer desligado a notch o corrompe...",False
7231,Same Energy,False
7232,assistindo vídeo de massa de pizza feita de brócolis acho que isso é a coisa mais adulta que aconteceu comigo essa semana,False
7233,comprando um freezer só pra poder desligar de noite e economizar energia,False
7234,tive dois pesadelos essa noite to desde a hora que eu acordei assim,False
7235,Chique…,False
7236,alguém sentou em cima do do controle da terra pq ta chovendo e ta sol e em vez de o sol diminuir pra refrescar ta aumentando,False
7237,pai de plantah,False
7238,"O meu condomínio e outro,a minha rua e outra é a distância e de uns 3 kms",False
7239,"Me ajudem! A Vakinha para o alimento do meu bebê está parada e quero pedir mais uma vez a ajuda de vocês ao menos com Rt's. Desculpem a insistência mais a situação está muito difícil  
@zehdeabreu @Tatawerneck @luanlovato @leticiaspiller",False
7240,perdi meu fone de ouvido meu mundo caiu,False
7241,"- te amo
- então prova 
 …",False
7242,"Ameeei!! Não sei quem fez porque recebi no celular, quem souber avisa!!",False
7243,"Uma mulher foi limpar minha casa lá e ela achou que o nome do meu irmão era Samuel

Samuel é meu cachorro…",False
7244,"Vivíamos escutando alguém chamando ""...TEEUS"" insistentemente e meu irmão smpre respondia achando q era alguém chamado ele (mateus). Meses dps descobrimos que era o vizinho novo chamando o CACHORRO, q tinha o nome de ZEUS!!!!!!",False
7245,"a cadela da bisavó do meu ex namorado também era Rebeca, sempre que ela chamava iam as duas pra garantir",False
7246,"quando eu era pequena eu tinha uma tartaruga, e o nome dela era júlia. na mesma época um cliente do escritório da minha mãe teve uma filha e botou o nome de júlia. então um dia eu ouvi ele falando sobre ela e mandei um “tio, o nome da minha tartaruga também é júlia”",False
7247,"se eu contar quantas vezes isso aconteceu cmg, pqp kkkkk…",False
7248,"eu um dia na casa da miga de  mamãe, ela chamando ""jady... jady"" e eu, ""qq é bicha chata?"", era a mulier chamando  a cachorra --'…",False
7249,"Uma vez estava na sala de um amigo e a mãe dele chegou gritando “vicky sai agora do sofá” eu levantei e ela disse “tu não a outra cadela”

A poodle era vicky
E tbm era cadela segundo a mãe dele...",False
7250,Isso já aconteceu comigo …,False
7251,Meu vizinho quando passa na porta de casa com o cachorro dele e o Rafael fica latindo KKKKKK…,False
7252,"passei na frente de uma casa perto da minha ai ouvi chamarem meu nome duas vezes

olhei pro lado

era o menino chamando o cachorro dele",False
7253,Intervenção hamstar já!!!!!!!,False
7254,"Super Mouse é seu amiiiigo
Vai salvá-lo do periiiiigo",False
7255,essa cidade precisa de um novo herói,False
7256,estou salvando o mundo na festa de halloween da @iwcuritiba quem precisar salvar alguma coisa no mundo hj é só falar,False
7257,"Já passamos da metade do objetivo da vakinha e temos 230 aguardando pagamento. Aos poucos estamos conseguindo o valor para comprar o leite do meu pequeno José  Gratidão eterna terei por vocês

@zehdeabreu @luanlovato @Tatawerneck @leticiaspiller @layfl",False
7258,"Gente, que história é essa que morri? Tava lavando o cabelo....",False
7259,"pensei em duas pessoas que eu não falava fazia tempo hj e as duas me mandaram mensagem

o meme nunca foi tão real",False
7260,GENTE ESSE MOMENTO É TODO NOSSO. #BrahmaMePatrocina…,False
7261,"""Quem tiver dúvida faz psipsipsipsi que eu vou à carteira""",False
7262,"Whoohoo !  
Halloween Party is this Saturday (6pm - 10pm) @iwcuritiba 

Have you got your ticket yet?  

Last chance to get it before the party! C-ya there! ",False
7263,eu gosto de ficar feliz sem motivo pq quando tem motivo é bem provável que uma hora o motivo mude ai vc n fica mais feliz então as vezes é bom ser besta e feliz sem motivo msm,False
7264,"RT DO BEM 

Amigos, o Núcleo Cultural de Apoio a Refugiados e Imigrantes da @Unisinos (NUCARI) está arrecadando brinquedos e materiais escolares para crianças refugiadas venezuelanas. Vamos ajudar? Lá no Facebook dá para saber como e onde doar: ",False
7265,"Isso é muito minha vida- NOME SUJO, no ar! ",False
7266,eu brigando com os fantasmas que fazem meus eletrodomésticos pifarem,False
7267,"Amigos, a vakinha para o pequeno José está meio parada vamos ajudar esse anjinho e a mamãe ao menos com um rt solidário. @zehdeabreu @lolaescreva @luanlovato…",False
7268,vivendo apenas esperando chegar meus dias de glória em que eu to na europa e as pessoas mandarem dinheiro pra mim pela @TransferWise igual a gretchen faz com os filhos dela  #ad #meurealzinho…,False
7269,"Gennnnnnnteeee, hoje eu fui completamente inútil ao meu país, não fiz NADA o dia inteiro hahaha",False
7270,"O Thor é um meninão cheio de alegria, vacinado e está procurando um lar pra chamar de seu.  Foi encontrado na rua quando era um nenénzinho e hoje espera um dono. Contato: (11) 98913-4752.",False
7271,mto ruim quando não da tempo de pular a música que vc não gosta dai ela começa tocar e vc fica com ela na cabeça e começa não achar mais tão ruim assim dai tem q admitir que tava errado o tempo todo,False
7272,"Criança oferece dinheiro do cofrinho para quem achar o Faísca, um cachorrinho da raça pinscher que sumiu no Dia das Crianças
 #G1",False
7273,sei la as vezes a gente só precisa ouvir 1 @patofu musica de brinquedo pra esquecer que a vida de adulto existe,False
7274,para todos os emails que nunca respondi..........,False
7275,acabei de descobrir todo um novo mundo de emails que vão parar na caixa de spam e eu nunca soube da existência peço perdão pelo vacilo de todos os emails nunca respondidos que eu nunca soube da existência,False
7276,"Wordzinha, PowerPointinha e Excelzinha são as heroinas do pacote Office!

Que tal levar TRÊS brusinhas dessa pra uniformizar o squad?!

Só tem que:
- me seguir @usebrusinhas aqui no Twitter
- dar RT nesse tweet 

O resultado sai dia 25/10",False
7277,"Cara, tokinho tem q ser patrimônio nacional haahHahahAahahahahahaahhaaahhaaha…",False
7278,"#ajuda 

Breno nasceu com uma má formação rara chamada #hemimeliafibular bilateral que trouxe diversas consequências dos joelhos aos pés. A cirurgia deverá ser feita com até 18 meses, e custa R$ 600.000,00. Ajude a divulgar.

…
…
#RT",False
7279,tomei um antialérgico e capotei de não saber onde estou isso nunca aconteceu antes com um antialérgico pq a parte de não saber onde estou já é mais normal na minha vida,False
7280,Bom dia @luanlovato  olha q fofo bom fim de semana…,False
7281,definitivamente sextou,False
7282,Sextou…,False
7283,"passando por aquele momento onde tem alguém podendo rir e dizer 

bom luan eu te avisei 

e infelizmente a única coisa que eu posso falar é 

vdd né minina vc avisou mesmo mas acontece é que eu sou loka",False
7284,tristíssimo pois por um momento minha cabeça achou q hj era dia de good place ai eu fiz tudo pra deitar e assistir 1 good place pra descobrir q n é hj,False
7285,"Vamos continuar nosso trajeto pela cultura baiana?? Nosso estado é lar de Gênias Maravilhosas!! Seria um pecado não falar delas. Claro que não conseguirei falar de todas, então vamos juntos lembrar da maior quantidade possível dessas mulheres baianas incríveis!!",False
7286,o @hugomoura1 ta profissional das thread maravilhosa no site …,False
7287,"quando eu era do bts
(๑˃̵ᴗ˂̵)…",False
7288,"Como os pais traumatizam uma criança sem querer: 
  Falei com Antonio que toda vez que ele fica pedindo um jogo novo (todo dia) uma fada morre 
 Encontrei ele triste aí perguntei pq, ai ele: é então por isso q nenhum dente meu caiu ainda, eu assassinei todas as fadas do dente",False
7289,gretchen ta a cara da gracyanne barbosa…,False
7290,eu com certeza faria psipsipsipsi e perderia o braço…,False
7291,comprei um bolo de pote e tava horrível ainda bem que paguei em real não precisei gastar em euro igual a gretchen,False
7292,tendo que me virar nos 30 pra conseguir fazer tudo que eu preciso fazer hoje só espero que o faustão apareça no final do dia na minha casa com um chegue gigante do premio por eu ter conseguido me virar nos 30™,False
7293,"Dá certo galere, pode confiar …",False
7294,notícias que nois gosta de ler…,False
7295,Me peguei fazendo movimento de pinça numa foto de uma revista pra tentar ampliar a imagem,False
7296,"q vontade de sentar

mas é sentar pra repensar nas minhas atitude q tão deixando a desejar",False
7297,finalmente relaxando um pouco olhando sites de coisas que eu não vou comprar só pelo prazer de dar uma olhadinha,False
7298,"as pessoa perguntando se ta tudo bem
eu respondendo no automático: tudo bem

eu por dentro :",False
7299,"5 mini gatos pra adoção em manaus!

podem ajudar na divulgação, por favor? @wwwmlna @exuliane @luanlovato…",False
7300,eu vivo no mundo da lua mas o mundo insiste em puxar meu pé pra fazer eu voltar pra terra,False
7301,"Ja foi encaminhado os papéis, para conseguir pelo SUS, mas o processo é demorado! Não tem como esperar, e nem arcar com os custos até que seja liberado.
Ajudem dando aquele Rt do amor/
Nós vamos conseguir! 

@zehdeabreu @marcinhaRocha89
@luanlovato",False
7302,"Nós estamos em 2019, essa menina está em 2064…",False
7303,"lembra do gato de franja? ele cresceu, mas a franja não. parece que ele tá pronto pra ir numa balada indie.",False
7304,agora do filtro do doguinho foi longe demais,False
7305,"Amigos do Twitter, meu gato está internado em estado crítico e preciso e colaboração de vocês para salvá-lo pois já estourei todas as minhas contas e ele precisa permanecer internado fazendo hemodiálise. Link da vakinha ->…",False
7306,"me segue no site onde eu eventualmente posto fotos mas todo dia perco seguidores adoidado
",False
7307,"me segue no site onde eu eventualmente posto fotos mas todo dia perco seguidores adoidado
",False
7308,Dois dias pegando ônibus sem fone já ouvi umas pérolas maravilhosas tipo ‘tem gente que apodrece mas não amadurece’ e ‘ depois de um certo tempo não importa mais a data de fabricação e sim o estado de conservação’,False
7309,"comprei uma cama nova pro gato =)

ele vai e dorme em cima da minha mala como sempre =(",False
7310,Morri e fui pro céu agora Deus tá fazendo eu ver tudo que eu fiz de novo pra ver se eu aprendo... mentira é só o #museumofme que o @muellercwb me chamou pra ir conhecer na estreia  em Shopping Mueller Curitiba ,False
7311,eu imaginando todos os argumentos pra uma discussão / eu discutindo,False
7312,"se quiserem favorecer o artista ao invés das cópias, a placa é da série Cães e Gatos do @sabadoqualquer 
…",False
7313,“carlos eu nao consegui deixar eles na rua”,False
7314,eu acho que todas as guitarra do mundo devia ter as corda colorida ai cada um coloca a cor das suas tipo mudar borrachinha de aparelho fica ai a dica pros guitarrista arrasar nos show tudo chegando com as cordinha nova coloridah #ColoRiR,False
7315,quem mais vcs queriam ver tocando a guitarra da diversidade hj? #ColoRiR,False
7316,se alguém quiser comprar a guitarra no leilão pra ajudar e não quiser a guitarra pode dar pra mim pois eu aceito ficar com essa preciosidade não tem problema #ColoRiR,False
7317,a guitarra da diversidade já posou pra fotos com mtas pessoas ela é famosíssima e poderosíssima maior estrela do festival #ColoRiR,False
7318,é mto legal ver o andreas kisser se propor a tocar a guitarra pra ajudar a causa em um evento desse tamanho com toda a visibilidade que ele tem #ColoRiR,False
7319,o andreas kisser todo de preto tocando a guitarra colorida é a gente saindo de casa gótica ouvindo musica feliz nos fone de ouvido #ColoRiR,False
7320,"Oi mores o @doritosbrasil me chamou pra falar de uma coisa mto legal e q é por uma causa mais legal ainda

agora no show do sepultura o andreas kisser vai tocar a guitarra da diversidade q ganhou cordas coloridas da bandeira LGBT+

VAMOS #ColoRiR MAIS UM DIA  #ad",False
7321,"O GERENTE FICOU MALUCO tudo pela metade do preço!
mas espere... OS CLIENTES TB FICARAM MALUCOS! querem pagar o dobro!
agora ficou um impasse",False
7322,"ficar sem mandar msg pra pessoa pra n atrapalhar

mandar 18 msg seguida depois q a pessoa fala qualquer a",False
7323,comendo uma frutinha depois de ter comido bobajada o dia inteiro pra fingir pra mim mesmo q to comendo direito pq o importante é comer um pouco de tudo né não tirar nada fora,False
7324,Só eu que vi uma camisinha?…,False
7325,200% meu dog,False
7326,talvez precisando de uns 3 dias de sono pra me recuperar ou talvez de desistir de tudo e começar uma vida nova quem sabe,False
7327,"Aliás, a Bahia é um Estado que é lar de GRANDES GÊNIOS e eu pensei em fazer uma thread sobre os grandes gênios baianos.",False
7328,"""ta bom tudo bem""",False
7329,essa noite eu sonhei com a autora do livro que eu to lendo e ela me ajudava a entender várias coisas do livro agora a projeção astral foi longe demais,False
7330,juninho bass groovador facilmente melhor coisa que aconteceu no rock in rio até aqui…,False
7331,Hj eu tive que escolher uma playlist comum pra ouvir no carro foi horrível…,False
7332,como eu vou saber as músicas q eu escuto agora???????…,False
7333,"""apagou mas eu printei"" blz fica 4,90 o print",False
7334,na vdd eu queria ir pra tulum que tem umas ruina maia e eu vejo e me da vontade de ir correndo pra esse lugar,False
7335,"Também estou sorteando, porém, a minha pode ser para Gramado (o sonho da minha vida inteira)…",False
7336,olá empresas de viagem estou sorteando uma empresa pra me dar uma viagem pra cancun quem quer participar do sorteio só chegar aqui,False
7337,como eu era romanticah,False
7338,"Quem puder ajudar com qualquer quantia, por favor, é muito importante!
São bem vindas também, orações pela saúde do Pedro ",False
7339,"vamo embora pelo amor de deus

vamo",False
7340,esse modelo de fim de semana com apenas 2 dias não se sustenta,False
7341,vendo os parente dar opinião bosta nos almoço de família #ÉramosSeis,False
7342,novelas de época contem comigo pra tudo #ÉramosSeis,False
7343,"eu compro as coisa tudo online pq minha diversão é basicamente ficar vendo site de monitoramento de preço pra comprar no preço mais baixo possível e nas loja q eu recebo de volta 

talvez eu seja doida n nego mas é mto bom falar minina nem te conto comprei numa promoção q nossa",False
7344,ATENÇÃO…,False
7345,"Dá pra vc fazer méliuz e Ame digital ao msm tempo, vc não recebe só uma vez, mas 2x",False
7346,"hj eu tinha umas 300 coisas pra fazer ai foi aparecendo mais um monte pelo caminho ai fiz tudo q apareceu to exausta e ficou tudo o resto pra trás pra fazer ainda

deus pq me abandonaste",False
7347,eu adoro o conceito de cashback vc compra as coisas que você quer e vc ainda recebe dinheiro de volta eu acabei de receber um email que caiu dinheirinho das coisa que eu comprei estou mto feliz,False
7348,os enfeite de Halloween da @iwcuritiba TEM UM GATINHO PRETO EM CIMA DA VASSOURA HUEUHEUHE EU AMO DEMAIS ESSE LUGAR,False
7349,mais um dia mandando e-mail só pra enviar documento em anexo e esquecendo de colocar o anexo,False
7350,"Duas gatinhas pra adoção em São Luís-MA. Elas dormem abraçadinhas e agora que têm 45 dias de vida. Serão entregues com tudo em dia (vacina, vermífugo etc). RT do amor @luanlovato @NaoInviabilize",False
7351,"Ganhei cupom no rappi, pedi um hambúrguer e eu mesmo fiz a entrega do rappi (pra mim mesmo)

Recebi 5 reais pra comer KKKKKKKKKKKK emprego dos sonhos",False
7352,"Eu não tenho palavras pra dizer o quanto eu amo essas playlists novas, todas as músicas que eu quero ouvir atualmente num mesmo lugar, é pra glorificar de pé…",False
7353,playlist no repeat do spotify conte comigo pra tudo se antes eu só ouvia as mesma musica agora mais do que nunca ouvindo só as mesma musica mesmo,False
7354,"Fazia bolos nesse estilo tbm, pena que parei.
kkkkkkk",False
7355,Vendo #RockInRio ... Mas queria mesmo #Pagode,False
7356,Imagina uma faca que transforma tudo em bolo: SONHO,False
7357,maria da paz vc está indo longe demais,False
7358,Um meme que ultrapassou gerações,False
7359,alo #marcas que quiser pratrocinar tbem estamos aceitando…,False
7360,self care é tudo né mininas (matar aula),False
7361,Acho uma falta de educação meus problemas ficarem aparecendo assim do nada sem marcar hora pra isso,False
7362,foo fighters ,False
7363,"Weezer é incrívellllll, conheci ouvindo California Kids e me apaixonei",False
7364,"uma banda que me deixa mto felizinho quando eu escuto e que vai tocar no rock in rio é WEEZER pois mto bonitinha as musica n tem como não ficar feliz junto

e vcs qual banda vcs querem ver pra  #ColoRiR o dia nesse rock in rio? conta ai pra gente! @doritosbrasil #ad",False
7365,pode acontecer várias coisas legais com a gente mas acho que nada deixa a gente mas ver quem a gente gosta FELIZ e conseguindo as coisas que quer COLORE A VIDA DEMAIS  #ColoRiR,False
7366,"ᵒˢ
     ʲᵒᵛᵉⁿˢ
                ᵈᵉ
                      ʰᵒʲᵉ
                              ˢᵒ
                ᵖᵉⁿˢᵃᵐ 
         ᵉᵐ 
 ᵘᵐᵃ 
         ᶜᵒⁱˢᵃ

entrar na internet e ver gif de bichinho pra #ColoRiR e dar forças pra continuar",False
7367,uma coisa que me deixa mto feliz no twitter é quanto todo mundo se junta pra ajudar alguém isso me deixa feliz demais não tem como não colorir o dia e ver que vale a pena viver nessa rede social #ColoRiR,False
7368,chegar em casa depois do trabalho exausta e ver seu doguinho vir correndo fazer festa simplesmente pq VC CHEGOU colore o dia demais pois amor verdadeiro #ColoRiR,False
7369,minha amiga vandi sabe se CURTIR e se #ColoRiR aprendam com esse anjo…,False
7370,"pirata / pirata 
…",False
7371,trabalhar mto pra ficar igual a gretchen e poder declarar que sextou na quinta feira já pois nada mais importa…,False
7372,hj eu acordei feliz tem até uns passarinho cantando na janela quando eu acordo pistola só tem a vizinha gritando e dizendo q vai matar o marido mesmo,False
7373,Pagar uma hidratação de 30 reais para meu cabelo / pagar um banho de 60 reais para o Slove…,False
7374,"devia existir um atestado pra quando a gente ta com encomenda pra chegar você vai no medico e diz

doutor não estou com cabeça pra mais nada estou esperando minha encomenda chegar 

ai pronto ele te da um atestado vc fica apenas esperando sua encomenda chegar.......",False
7375,essa noite eu sonhei que a lana del rey vinha pro brasil dai ficava indignada com umas coisa e resolvia ficar dai ela ficava morando com uns vizinho meu que já moraram fora do brasil dai a gente virava amiguissima?????? dai basicamente eu dava altos role com lana del rey,False
7376,BOM DIA TODOS E TODAS,False
7377,bom por hj é isso pessoal vou me recolher aos meus aposentos e desancar bjs pra quem fica e até amanha dorme com os anjo,False
7378,fiz uma compra online e a entrega vai ser por FEDEX achei chiquérrimo estou me sentindo o próprio naufrago espero que venha um wilson junto na minha caixa também,False
7379,haha como todo mundo ta descobrindo meu MSN ?,False
7380,MSN - gabigol_matador@hotmail.com,False
7381,meninas comecei fazer jejum intermitente com uma hora de jejum a gente perde quantos quilos mesmo?,False
7382,meu deus o vídeo  uheuhehue,False
7383,"O sonho da minha irmã era ir no cemitério, e minha mãe ainda leva ",False
7384,vou fazer um book novo de pirata e gatinho mais nunca mais tirei foto dos princeso…,False
7385,eu errei o tweet 3 vezes isso nunca aconteceu antes nessa indústria vital nessas hora vcs me perdoe e me ajuda eu tenho 2 gato pra cria,False
7386,Aqui já tá assim.,False
7387,"eu nunca tenho vontade de por o pé pra fora de casa no fim de semana pra fazer nada ai bem no fim de semana que eu vou em um evento aparece mais 418 que eu queria ir também 

assim fica difícil meu patrão",False
7388,bom já tem panetone no mercado acho que já da pra começar desistir das coisas oficialmente e deixar pro ano que vem que já ta ai,False
7389,"Gatos em mesas de vidro

A thread",False
7390,"Vc só recebe o que dá. Se é mal educado e arrogante, por exemplo, é só o que vai receber de volta. E não adianta culpar o universo e nem as pessoas que estão te ignorando ou te tratando mal. São só espelhos do que vc tem na mente.",False
7391,o passado é pó,False
7392,"eu: esse mês vou economizar já gastei mto

cupom: a

eu:

#ÉCupomQueVcQuer",False
7393,"olhando coisas que eu                   tem cupom
não preciso comprar                   de desconto
tanto asssim 

 #ÉCupomQueVcQuer",False
7394,"eu compro tanta coisa em promoção que até minha familia já acostumou ai quando eles querem comprar alguma coisa eles pedem pra eu procurar pra eles

eu me sinto 200% assim entrando na internet procurar os cupom #ÉCupomQueVcQuer",False
7395,"não satisfeita em dar apenas um cupom @magazineluiza ENCHEU O APLICATIVO DE CUPOM 

CORRE LÁ VER MININA #ÉCupomQueVcQuer #ad",False
7396,"É HJ QUE EU VOU USAR OS CUPOM E FAZER AS COISAS QUE EU MAIS GOSTO NA VIDA

COMER E FICAR OLHANDO AS PROMOÇÃO DA INTERNET 

NADA PODE ESTRAGAR MEU DIA #ÉCupomQueVcQuer…",False
7397,eu fazendo compra sem cupom / fazendo compra COM CUPOM  #ÉCupomQueVcQuer,False
7398,"Se tem uma coisa que me deixa feliz nessa vida é CUPOM 

quer ver o capricorniano feliz DA UM CUPOM PRA ELE ECONOMIZAR COMPRANDO O QUE ELE QUER QUE NÃO PRECISA MAIS NADA #ÉCupomQueVcQuer #ad…",False
7399,Poderia comprar e virar Huawoi…,False
7400,ouvindo paul mccartney silly love songs pois sou boba e apaixonadah,False
7401,quando digo que sou autossuficiente e não preciso de óculos,False
7402,eu conversando com voz de criança com o dog / meu dog,False
7403,"minha família: q q será que ele faz tanto tempo nesse banheiro

eu no banheiro:…",False
7404,desculpa agora não posso to muito ocupado tentando grudar os resto do sabonete velho com o novo,False
7405,acho mto maravilhoso como a academia mantém vivissimo nosso instinto que vem desde os tempos de escola de arrumar qualquer desculpa pra não poder ir a diferença é que dessa vez não tem a mãe pra obrigar então qualquer coisinha que acontece nois mata academia mesmo não tem jeito,False
7406,bom dia só pra quem não teve seus sonhos destruídos pelo despertador......,False
7407,hj o despertador tocou no meio do sonho que eu tava tendo como eu vou viver esse dia agora sem saber o fim das história que eu tava criando só dentro da minha cabeça,False
