,text,is_depressed
5248,"LIVE ON 

ASSISTINDO PESADELO NA COZINHA

encosta ai, vou dar uns 10 min p dar tempo de todo mundo entrar



",False
5249,"eu ando na rua tao distraído quando to resolvendo alguma coisa no celular que eu nem percebo onde to indo 

eu acabei de sair de uma clínica de emagrecimento 

e eu tava indo na claro troca meu plano",False
5250,"Para mim, o Tweet mais engraçado do Brasil é o do papo com a avó, publicado por @Brunozor. Qual é o seu voto? #RindoAltoNoTwitter",False
5251,"quem diria em 

estamos concorrendo ao tweet mais engraçado do brasil pelo PRÓPRIO TWITTER 

um menino que num tinha dinheiro nem pra compra um requeijao e ta ai 

sem dinheiro pra compra requeijão mas concorrendo a premiações nacionais",False
5252,"Para mim, o Tweet mais engraçado do Brasil é o do papo com a avó, publicado por @Brunozor. Qual é o seu voto? #RindoAltoNoTwitter",False
5253,"Para mim, o Tweet mais engraçado do Brasil é o do papo com a avó, publicado por @Brunozor. Qual é o seu voto? #RindoAltoNoTwitter",False
5254,"vota em mim aí rapaziada 

o meu é o Papo com a Avó 

se eu ganha vai te open frango assado com batatas e farofa sobremesa muse de chocolate do padre…",False
5255,Chegou a hora de decidir qual é o Tweet mais engraçado do Brasil! Contamos com a ajuda do pessoal do @memeawardsofc para a curadoria das indicações e chegamos a quatro finalistas. Dá uma olhada na thread e vote no seu preferido! #RindoAltoNoTwitter,False
5256,eh assim que eu começo os meus dias agora!!! …,False
5257,"mlk hoje foi o recorde de dar coisa errada 

essas hora sabe oq eu queria ser 

um grilo 

fodase",False
5258,"me ayuda @TransferWise 

muito triste junta dinheiro pra viaja vai faze simulacao da conversão pra dolar 

converte

2 dolares 

tenho renda para comprar um alicate",False
5259,"bom dia um poco tarde mas como diria alguem antes tarde do que nunca 

tao vendendo seda no trem e o anuncio do cara eh 

FOGO NA BABILONIA EH 3 por 10",False
5260,essa tatuagem parece uma nossa senhora aparecida …,False
5261,carai mlk eu so amigo do vitinho do sus,False
5262,"eu aprendi no pe de fava a desligar a minha geladeira de dia e deixa ligada só a noite

eh ótimo economizo muita energia e tirando que de dia nem fico em casa estou no hospital tentando curar uma intoxicação alimentar que peguei não sei oq pode ter sido",False
5263,vitinho do sus entre em contato comigo quero ser seu amigo …,False
5264,"o spinardi do haikaiss vestido de coringa 

pensou vc vai num show o cara abre assim   eu num sei se choro lembrando do filme e abraço ele ou se fico com medo",False
5265,"mano ultima vez que vim aqui pro interior voltei pra são paulo com febre amarela 

vcs nao ta ligado no tanto de repelente que to passando 

eu to escorregadio parecendo uma carpa 

as pessoa me abraça eu escapo pra cima

nao quero fica doente dnv",False
5266,"to no interior visitando meus pais e meu irmao

pra qm nao sabe eu tenho um irmao de 15 anos que é especial

ele é autista nao verbal, então não fala e tbm n entende

gosta de assistir youtube e ficar pelado as vezes do nada sem motivos

eu acho fofo ele assistindo baby shark nu",False
5267,"Como é crescer como uma Criança Amarela no BR?
A um tempo atrás fiz um quadrinho retomando várias memórias da minha infância. Tentei botar todas minhas experiências pessoais no desenho. Este é o Criança Amarela :)
Segue a thread",False
5268,"cheguei no interior 

a cidade da minha mae não tem semafaro 

estou com uma moto de leilao 

mas deixando claro que sou habilitado e responsavel

nada pode me parar 

só deus e o detran",False
5269,eu amo minha mãe,False
5270,"a @GretchenCantora fez um post falando sobre a @TransferWise que ela ajuda na hora de converter o dinheiro pra fora do brasil 

pior que eu li tudo achei mo interessante entrei no site pesquisei 

e nem tenho dinheiro pra converte",False
5271,"seloco colei no são paulo fashion wek ontem bagulho mo chique

os cara passava oferecia uns negocio mo esquisito

pior que eu tava com tanta fome que eu aceitei todos pra ve qual que era

mano comida de rico eh ruim demais
voces rico que me descupe 
tem gosto de alicate amilanesa",False
5272,preciso tira uma ferias em uma ilha deserta sem sinal eu e as tartaruga,False
5273,"um dia eu vo paga meus boletos em euro igual a gretchen

vao fala nossa vc paga seus boletos em euro e eu vou responder sim",False
5274,"peguei uma garrafinha de agua que eu ganhei e trouxe pro trabalho

meta eh beber pelo menos duas dessa por dia

namoral vamo junto nessa missao hidratante

me senti um programa infantil falando isso

VAMOS AMIGUINHOS NESSA SUPER MISSÃO HIDRATANTE 

mas é sério vamo nessa missao",False
5275,meu primeiro contato com o telegram esta sendo assim,False
5276,same energy,False
5277,eu nao confio em quem gostava de ilha ratimbum,False
5278,"cheguei na psicologa

acho q essa parte de esperar na salinha é a mais difícil

pq vc fica pensando
qual tema eu foco

preciso falar de tantas coisas
estou com muitos problemas na cabeça

confesso q quase nunca me sinto melhor quando saio e acabo desistindo

preciso insistir mais",False
5279,"bom dia amigos

passando pra desejar um dia legal pra voces

as vezes a vida da uns murro na gente mas temos que segurar as pontas e esperar as melhoras

nada é pra sempre
a felicidade uma hora acaba
mas as tristezas tambem

tudo é temporário
compro PS4 usado preço desapego",False
5280,"peguei um uber hoje aí a gente tava conversando que as vezes tem uns motorista que eh meio grosso e tal 

aí ele 

esses aí eh os corno que sai pra trabalha fica com medo de leva chifre em casa aí desconta nos outro",False
5281,"meu unico foco no momento eh me manter lucido e tomar 2l de água por dia 

a parte da agua ja falhei",False
5282,"que vontade de ir embora da internet pegar meu cavalo subir nele e nunca mais volta pra essa terra de pessoas que se xinga o dia todo 

o problema eh que nao tenho um cavalo",False
5283,"vcs ja percebeu que a bosta so faz barulho na privada quando nao eh pra faze 

vc ta em casa sozinho caga um coco do tamanho de uma criança de 4 anos 
silencio absoluto 

aí vai caga na casa de alguem

parece um missil da força tática caindo no mar",False
5284,eu gosto mais do patati patata do que de vc,False
5285,"acabei de encontra um mano que eu assisto desde pequeno a

aí fiquei mo nervoso sem saber oq falar virei pro cara e falei 

vc eh um anjo

e sai andando",False
5286,panetone > chocotone,False
5287,"os cara xingando a menina que tirou uma foto comigo e postou dizendo que tava feliz que me conheceu

o quao inutil tem que ser a vida de uma pessoa pra ela fica xingando uma menina que postou uma foto com alguem que ela acha legal 

deixa a menina queta para de ser idiota",False
5288,"sem condições de ir na BGS hoje 

meu pé ta doendo minha perna ta doendo meu suvaco ta doendo 

alguem de vcs ai vai? mo legal quando encontro voces nos lugar 

precisamos se encontrar mais vezes jogar uma bola assisti um filme",False
5289,fodase,False
5290,"a uma empresa aqui da BGS que fechou comigo uma parceria pra gravar umas parada no stand deles 

aí eu fui la falei com o pessoal gravei fiz mo role pensei  bom pelo menos vo ganha um mouse novo to precisando  

ganhei uma garrafa de agua",False
5291,"lacre no tenis pra que  me fala pra que         o bebe vai faze o que com o lacre 

VAI COME O LACre e enGASGA 

A MOÇA SALVO ELE",False
5292,"penso vc chega la na defensoria publica

-doutor vc precisa me aju...doutor vc esta nu …",False
5293,muito difícil ser gotico e usar roupa preta nesse sol estou me sentindo um peru de natal perdigao,False
5294,o coringa eh palhaço de verdade ou gente vestida de palhaço,False
5295,"garimpei a bgs hoje fui nos stand pedir coisa pras empresa falei assim:

o twitter eh um lugar incrivel vcs precisa apoia o pessoal de lá me da uma cadeira gamer

eles falo assim: nao

to brincando, falo que vai me manda mensagem vamo espera ne

se eu ganha cadeira vo fica feliz",False
5296,"ontem fui num evento tinha um touro mecanico se vc ficasse em cima dele mais de 30s vc ganhava um desodorante 

segurei aquilo com tanta força como se minha vida dependesse disso 

peidei de tanto faze força

cortei o dedo

minha perna nao ta funcionando mais

cai no 22 segundos",False
5297,recebi algumas fotos do meu irmão no passeio da escolinha e descobri que ele me representa 100%,False
5298,"comece a redação do enem com 

- Falaaaaaaa pessoal aqui quem fala eh (insira seu nome) games

deixa o like favorito e vamo pro que interessa DESAFIOS DA MOBILIDADE URBANA NO BRASIL",False
5299,"comece a redação do enem com 

- nao estudei absolutamente nada sobre esse tema mas vo falar o que eu penso",False
5300,"comece a redação do enem com 

- como que existe uva sem caroço se eh o caroço que nasce a uva

atenção aos espaços de parágrafo 

- e se tem as sem caroço como que planta mais dela se nao tem o caroço pra fazer mais uva sem caroço 

termine com 

- me ajuda",False
5301,"dicas redação do enem

-não faça 

to brincando galera faz sim 

faz o que voces quiser na verdade ninguem manda em ninguem   só a sua mae ela manda em vc respeite as decisões dela",False
5302,"amanha começa brasil game show 

fui convidado pra ir la entao se voces for e quise leva presente ou me da pao de batata de frango com catupiry eu como 

to nervoso 

fico meio assim pq ultimo evento assim que fui apanhei de um homem aranha de 11 anos",False
5303,hoje só to fazendo parceria boa,False
5304,"boa noite rapaziada 

estou ouvindo camila cabello 

esse é o tweet 

se vc quiser ouvi musica da camila cabello vc pode tambem

todos podemos ouvir camila cabello 

boa noite camila cabelo 

 #CryForMeOutNow",False
5305,"eu comecei ler achando que era serio pensei caraí daora vo deixa o quintal de casa igual a disney 

a",False
5306,"todo restaurante que me segui eu vo posta aqui como pedido de patrocinio 

casa do pastel nobiu peço que pensem com carinho",False
5307,"que fome de vitoria hoje eu levantei da cama dando voadora nos problemas 

ninguem pode me parar apenas a fatura do meu cartao de credito",False
5308,"to no cinema meus amigo me arrasto pra assisti coringa 

eu tenho medo de palhaço que mata pessoa nao gosto 

vo caga na cadera so de odio vao te que ve duas hora de filme com chero de bosta",False
5309,"cArai ja passo esse video do cerebro umas 10 vez na minha tela toda vez que vejo essa desgraça me da fome 

natal ta chegando em",False
5310,quem ta dormindo curte esse tweet quem ta acordado manda meme de animais,False
5311,"eu acho que cometi um crime de roubo 

fiz mercado e quando abri as sacola aqui em casa tem um pacote de salame 

eu nao comprei salame 

se alguem aí perdeu um pacote de salame saiba que está comigo espero que entenda esse mal entendido",False
5312,"tem hora que nois começa acha que nao eh bom em nada ne 

tenta ali tenta aqui 

nada fica bom 

carai eu vim no mundo pra que senhor nao e possível que minha missão na terra eh lava louça",False
5313,"Pri, 30 …",False
5314,acho que o mundo seria um lugar melhor se houvesse stands na rua de pessoas dando panetone pra gente,False
5315,"carai acordei ta rolando um lollapalooza kids na frente de casa 

parece um rave infantil 

as criança fritando ao som de   a dona aranha",False
5316,estou muito doente  o médico me disse  que a única solução  eh eu mama esse cacetao alado  ja saiu os resultados dos exames  estou com lepintospirose ,False
5317,"RT SE VC JÁ 

morreu 

foi amigo do michael jackson 

jogou bola com o michael jackson 

viu o michael jackson depois que morreu em um bar no interior de minas gerais 

ja namorou o fabio junior e traiu ele com o proprio filho fiuk 

ninguém nunca saberá o que é só você ",False
5318,nao gosto de dormi sem roupa tenho medo de acontece alguma coisa a noite e eu precisa corre e ta pelado,False
5319,"Pri, 30 , desempregada",False
5320,se eu entrasse no de ferias com ex nao ia transa nao     imagina minha mae vendo uma coisa dessa que cena horrivel eu pareço um grilo de baixa renda,False
5321,"acabei de assistir de férias com o ex pela primeira vez na vida e senti vontade de afoga todos participante 

menos meu patrão @LeoPicon parabens estou adorando sua participação so precisa melhora o bejo   na boca 

se me mandar embora por isso vc nao tem sentimentos nem coração",False
5322,"eu to passando por um conflito pessoal

eu gosto de assisti vídeo de alguns youtubers que começa o vídeo tipo ARAREEEEEAFALAAAAPESSOALAAAREAMEUSLINDUXO

mas eu tenho muita vergonha de alguem ve eu assistindo

isso atrapalha o meu entretenimento pois assisto todos com volume no 2",False
5323,"eu queria deixa registrado aqui as 10:17 da manhã quinta feira 

eu admiro todos que toca gaita acho um instrumento incrivel 

bom dia se voce toca gaita vc eh foda 

""bom dia"" pro restante da população que nao toca gaita",False
5324,nao sei da onde vc tiro que é bom dia,False
5325,"Pri, 30",False
5326,quando a gente chega em 430 mil seguidor vo sortia um frango assado com batata e farofas e uma caxa de chocolate do padre pra faze bolo,False
5327,quando vai chegando esse horario perto da 00:00 eu queria congelar o tempo pra dura mais umas 3h pra eu assisti alguma coisa legal sem te medo de sofre pra acorda amanha,False
5328,"rapaziada vo da uma pausa lá na thread que eu to fazendo pq tem mais coisa triste do que engraçada e esse perfil ta ficando com clima ruim 

voltamos à programação normal 

curiosidades do mundo dos animais 

vc sabe como as cobra transa? 

nao?

eu tbm nao",False
5329,"hoje vi um video dos cara fazendo capirinha na maquina de lava roupa 

nao tem comentário sobre   só queria fala isso",False
5330,"amanhã atualizo mais uma parte da thread

tem muita coisa que eu tava desacordado entao vo pedir pros meus pais me ajudar com essas informações

usem o @remindmetweets pra lembra vcs da thread

amanhã começa a parte que agravou tudo mas tambem tem coisa engraçada

boa noite bjoks",False
5331,"FEBRE AMARELA - a thread

muita gente ficou curiosa sobre a doença que eu tive esse ano

é claro que todos vcs conhecem a febre amarela

mas o que pouca gente sabe é o quao ruim eh essa doença e a gravidade dela

nessa thread vou tentar resumir o que eu vivi nos 30 dias de UTI",False
5332,"as vezes eu nem acredito que vivi e sobrevivi isso, toda vez que eu lembro da vontade de chora, vocês foram incríveis comigo, sempre mandando mensagens de apoio pra mim e a minha familia e eu vou ser sempre grato por tudo  obrigado, vcs realmente mudaram a minha vida",False
5333,"vcs que nao gosta de mim 

eu entendo!!!!!! 

eu tambem nao gosto!!!!
mas nao tenho outra solução!!!
alem de viver comigo mesmo!!!
para sempre!!!!!",False
5334,"nossa caí da cadeira aqui no trabalho que cena lamentável 

fiquei estirado igual um pedaço de bosta 

fico meio que um silencio todo mundo se olhando uma parada meio 

  vamo espera 5 segundos se ele respira normal a gente ri se nao respira a gente chama abulacia",False
5335,"Pri, 30",False
5336,dialogos no whatsapp com meu sobrinho,False
5337,"e eu que cochilei agora tarde sonhei que tava cozinhando pro whinderson e pra luisa 

sera que meu futuro eh se um chefe de cozinha 

minha irmã nunca comeu nada que eu fiz na cozinha pq uma vez ela me viu coçando a bunda

vc acha mesmo que os melhor chefe do mundo nunca coço ne",False
5338,"aquele momento que fica vc e o entregador no portao esperando a maquina de cartao funciona 

eu pro motoqueiro 

-hoje ta frio em 
 -...
-vc trabalha em quais aplicati
-funcionou coloca o cartao 

amores liquido demais eu so queria te ama e vc foi embora levou todos os meus sonho",False
5339,olha como estou bonito nessa foi o @aredead que fez isto …,False
5340,ESSA VAI SE A FOTO MAIS FELIZ DO MEU INSTAGRAM KKKKKKKK …,False
5341,meu cabelo ja foi comparado com cachorro vivo mas morto e a primeira vez,False
5342,"eu acordei às 08 da manhã pra assistir a pré estreia de angry birds 2 

chegou la no cinema 

eu e 95 criança 

me diverti mais que todas elas

eu preciso evolui como ser humano",False
5343,vo dormi boa noite a todos menos @Drake,False
5344,"tenho compromisso amanhã cedo e to aqui xingando o drake malfoy e assistindo video de reforma de casa 

preciso prioriza melhor o meu tempo na internet",False
5345,".@Drake achei muito zuado da sua parte fazer isso primeiro que a gente nao gosta das suas atitudes mas queria ver o show ja que nao temos dinero para comparece ao festival 

segundo achei muito zuado da sua parte fazer isso primeiro que a gente nao gosta das suas atitudes mas qu",False
5346,eu falava que esse drake malfoy era pau no cu desde o harry poter ninguem acreditava agora ta ai tranco o show do rock in rio pro pessoal de casa nao ve parabens viu professor doubladore,False
5347,"carai mlk vi uma promoção de 2 combo de lanche pelo preço de 1 

comi tudo to sentindo que a qualquer momento vo te um abc 

boa noite pra vc que ta em casa 
assiste broklyn 99 comecei a ve aqui bem loco 

eh de um detetive de policia

saudade demais da minha vó",False
5348,"SALVE RAPAZIADA TAMO ONLINE primeira live lá na twitch 

 

manda uns vídeo legal pra eu assistir com vcs lá 

pode mandar kpop também 

",False
5349,devolva. a minha.  galinha…,False
5350,"essas hora o rio de janeiro ja ta com a cidade toda habitada por pessoas do mundo todo os gringo pagando 50 reais em um pastel 

queria ta la 

vamo faze um grupao de todo mundo que nao foi no rock in rio pra nois se consola",False
5351,que inveja dos japones essa hora ja e de noite la eles tao sextando,False
5352,achei que ia acorda animado pq é sexta e to com vontade de se o noturno do x men pra disaparece,False
5353,desisti de ir pro rock in rio por pura livre espontânea vontade que tbm pode se chama de nao tenho dinheiro e nao ganhei pq nao so uma pessoa importante o suficiente para isso,False
5354,"os cara aqui do trampo falando de viagem de escola forma turismo  clube medi 

nunca fui nesses passeio minha escola so levava a gente pra fazenda faze carinho nos cavalo",False
5355,"bom dia eu sei que vc tá desanimado

eu tbm to 

mas hoje é quinta feira então eh só mais um dia e a gente termina essa semana 

toma um copao de agua pensa que é um gatorades e ja volta pro dia no pique do raichu cruzado com o sonic nasceu o raisonic solta choque e corre",False
5356,"eu queria ir pro paraguai compra coisa pra vende aqui no brasil celular, caixinha de som

toda vez que eu conto isso pras pessoa elas me olha feio como se eu fosse o pablo escobar da jbl",False
5357,"as coisas dando errado 

eu desanimado 

a vida: ok vamos melhorar isso 

as coisas começam a dar certo :)

eu continuo desanimado",False
5358,bateu mo saudade da copa a timeline toda fazendo piada e chamando o goleiro do brasil de gostoso,False
5359,"eu sempre compro umas coisas meio sem certeza

aí antes de chegar eu fico assistindo review no youtube pra ver se fiz bosta

aí as vezes eu vejo que fiz mesmo

então começo a procurar os vídeo antigo de 2011 quando aquele item ainda era bom pra me convencer que fiz uma boa compra",False
5360,"to gripado dnv 

nao eh possível um ser humano fica gripado metade do ano 

mas tbm nessa cidade que um dia ta o calor do deserto 

e no outro parece que somos todos jogares do club pinguim

nao tem como nao ficar gripado",False
5361,COMEÇOUUUU!!! luquinhas lindo  #TrampoZikaNaMtv,False
5362,marque aqui sua amiga que ia cair nessa armadilha,False
5363,"voces sao muito fofinho curtindo e participando dos post quando eu to fazendo alguma propaganda aqui 

brigado mesmo 

se eu fica rico um dia vo compra uma casa grande nois vai mora tudo junto 

e vai te banda ao vivo cocoricó e comida petiscos   menos narguile ok esse n gosto",False
5364,"o jovem que vai mora sozinho só pensa em uma coisa 

móveis baratos com desconto #Mes9da99 #ad

você cria um desejo de coisas que vc nunca quis antes como por exemplo um faqueiro 

sendo que nem faca vc tem ainda",False
5365,"quando eu tinha uns 12 anos eu tava sentado com uns amigos conversando e senti MUITA vontade de peida

nessa hora eu levantei e tentei correr pra longe mesmo não fazendo sentido

eu só não queria peidar na frente deles

eu dei 3 passos caí e comecei peida no chão

na frente deles",False
5366,"pelo amor de deus mary jane, tem mulher aqui nao",False
5367,"meu amigo compro um tenis de 5 mil reais 

sabe o que é isso 

o preço de uno usado 

o cara podia ter um uno com escadinha em cima igual o suporte da vivo mas compro um tenis",False
5368,"acho mo fofo quando o entregador de pizza ta com a namorada junto na garupa de mochila 

eles sao uma equipe 
ele dirigi ela entrega 
batman e robbin do mcdonald 

e no final da noite eles se dão  um bejo e fala te amo",False
5369,"mais um dia que nao acordei sendo uma blogueira que recebe mimos no conforto do seu lar

expectativa: gravar story dos presentinhos e mimos

realidade: to no onibus treinando o equilibrio

nao segure nos suportes do onibus CONFIE NO SEU POTENCIAL

eu quero se blogueira de sucesso",False
5370,"A mãe de um amigo está com carcinoma no pulmão e os recursos para custeio estão se esgotando, pois eles estão gastando com transporte, tratamento... Então, quem tiver como contribuir com doações ou só compartilhando o link, já uma baita ajuda!
Link:…
Valeuu!",False
5371,troquei as etiqueta do meu alarme,False
5372,olha eu atravessando a rua igual os beatles …,False
5373,"e eu que fiquei num hotel pago da empresa e nao tava comendo nada do quarto pq tava com medo de te que paga depois

e descobri hoje que era tudo de graça 

eu comi um amendoin pra passa a vontade do chocolate que eu queria PQ NA TABELA tava 18 reais

e era de graça

ERA DE GRAÇA",False
5374,"to no salao de corta cabelo 

toda vez que vo corta o cabelo eu fico nervoso parece que to prestes a estraga minha vida 

e as vezes eu realmente estrago",False
5375,"eu assisti uma palestra sobre criatividade/produção de conteúdo 

aí o mano falava 

vc tem que junta dois tema diferente. 
pense duas coisa na cabeça, coisas diferentes. eh assim que nasce as ideia genial. 

fui tenta aqui 

passarinho   esfiha",False
5376,quero ir no rock in rio porem fiz as contas e meu orçamento me permite a compra de um cd da banda ruje,False
5377,"o passarinho do angry birds ta querendo tira o lugar do meu amigo loro jose 

eu apoio pois o loro ja esta rico muitos anos de tv eh a hora desse passaro fica rico tbm 

@MaisVoce 

ajudem este pobre passaro comentem #ChuckNoMaisVocê…",False
5378,"comida de bar eh boa demais irmaosinho 

eu to tendo a oportunidade de colar em varios restaurante chique que a galera me chama mas afirmo com toda certeza do mundo 

os pratão 23 reais bate em todos eles

deus abençoe os cozinheiro de bar",False
5379,"bom dia acabo de passa na minha timeline um pinto tocando teclado

o pinto awards tem um impacto muito grande na sociedade",False
5380,"cachorros ama de verdade

humano so fala que ama mas é mentira acredite so em cachoros",False
5381,vo usa essa aqui todo fim de semana que eu nao quiser sai,False
5382,o calor parece que deixa nois mais cansaço ainda   eu chego do trabalho me sentindo uma paçoca amassada que vc acha no bolso,False
5383,e foi assim que consegui uma foto com um amigo que mora longe e não nos conhecemos pessoalmente …,False
5384,"eu e luquinhas passando aqui para parabeniza o menino ciclopin pelo seus 15 anos 

feliz aniversário aproveite seu dia irmao   te amo",False
5385,"RT PRA AJUDAR um fotógrafo comprar uma lente

Tô com uma promoção de ensaios pra quem fechar nas próximas 24 válidos somente em São Paulo.

Eae bora fazer umas fotos shows?",False
5386,aí aí aí...…,False
5387,onde vai se o rock in rio?,False
5388,"meu cabelo ta grande a menina que eu gosto falo que vo fica careca usando boné toda hora 

aí eu brinquei né 

    eh dos careca que elas gosta 

   e ela confirmo 

nunca mais brinco",False
5389,"so tem ódio na timeline do twitter

e eu me sinto um hippie falando isso

eu nem so esses maluco goodvibss mas porra ultimamente o bagulho ta loco nem meme aparece mais eh só incendio e briga

cade os video do marco descendo o morro da casa da vó dele chamada sovelina",False
5390,"Gente, quem são os cristais do audiovisual, filmmakers, produtores, diretores de video negros que vocês conhecem? 

 Luz, câmera, ação! Take 01, responde o Tweet ",False
5391,"quero ir no rock in rio 

tenho 10 reais",False
5392,"e hoje a mulher no aviao falando 

nao se preocupe em caso de acidente temos 6 saída de emergencia 

aí eu pensei 

 que bom ne 

 6 lugar diferente pra pula do ceu",False
5393,"mano a tecnologia tá quase chegando nos carro voador #ad 
 
tava olhando o app da rappi 
 
da pra contrata alguem pra reforma a parede de casa, alugar um patinete eletrico e compra passagem pra voa de aviao tudo no mesmo aplicativo
 
os cara monto o exodia dos serviço",False
5394,"postei no instagram storie pedindo indicações de coisa legal pra faze no meu bairro 

me falaram de 

uma sorveteria 
um bar universitario 
e uma praça que tem tiroteio 

muito bom as atração gostei vo na tercera",False
5395,no istagram eu so uma farsa tudo atuação,False
5396,vc voando no céu enquanto os seus fãs la embaixo sofrem no calor      que tipo de ídolo é vc?,False
5397,"amigos, nao eh pra escuta esses cara aí falando que nao tem que usa camisinha

tem que usa sim

encapa esse pinto poe a ropinha transparente fica parecendo os acessorio do video quanto custa o outfit

vc não quer ter um pau hype? pensa bem

agora é sério
usa camisinha 
eh nois",False
5398,eu no evento de empreendedor aprendendo fica rico pra leva meus cachorro pra disney …,False
5399,os comentario da live que eu fiz do voo no instagram,False
